appid,short_description
1183,Put your truck driving skills to the test in Trucks &amp; Trailers! Complete basic training and set on the way to master the wide variety of challenges that lie ahead.
1184,"In Bus Driver, your job is to transport passengers around an attractive and realistic city. You must drive to a timetable on a planned route, whilst obeying traffic rules, and taking care not to upset or injure your passengers."
1185,"Floating Point is a peaceful, free game about using a grappling hook to swing yourself gracefully through randomly generated spaces. The only objective is to collect points, and the only thing that increases your points is swinging swiftly, smoothly and elegantly without hitting anything."
1186,"In a land of enchantment, torn by evil, a hero arrives to save the day! Guide Solar and his band of helpers as they set out to stop the dark sorcerer Grogan from achieving eternal life and to rescue the fair Lumina."
1187,Of Guards and Thieves is a multiplayer stealth game in which high-powered guards face off against fast and elusive thieves in a contest of wits. Outsmarting the enemy and shooting your way through to the goal are equally valid strategies.
1188,Boson X is a fast-paced rotational runner set in a particle accelerator.
1189,"Cyto has lost his memories, help him get them back. Fling Cyto through beautiful, other-worldly levels to collect memory fragments and piece together his story in this irresistible, cute, and challenging puzzle game."
1190,"Call to Arms offers an innovative mix of real-time strategy and 3rd, as well as 1st person controls. Set in the time of modern warfare, the game offers realistically modeled vehicles and heavy weaponry, as well as dozens of firearms and customizations."
1191,"BlazeRush is a dynamic arcade racing survival game with no health, no levelling and no brakes! You can assemble a team of friends to play in local or online multiplayer, choose a car to your taste and chase, blow up and cut off! Adapt your style and tactics to new enemies, obstacles and tracks."
1192,"BLOCKADE 3D! First Person Shooter in an editable procedural cubic world. A large arsenal of weapons, 4 teams at the same time and up to 32 players on one map. A large number of game modes!"
1193,"The Beginner's Guide is a narrative video game from Davey Wreden, the creator of The Stanley Parable. It lasts about an hour and a half and has no traditional mechanics, no goals or objectives. Instead, it tells the story of a person struggling to deal with something they do not understand."
1194,"Quilly was abducted by aliens, now, he has to fight for his freedom! Destroy cube aliens with guns, bats and inteligence... avoid traps and more. Dead Bits is a first-person shooter with original dubstep soundtrack for Windows and Mac."
1195,"The Witcher Adventure Game is a digital adaptation of CD PROJEKT RED’s board game set in the brutal fantasy universe of monster slayer Geralt of Rivia. Travel across the beautifully rendered world of The Witcher and complete a variety of quests — hunt deadly beasts, solve ancient mysteries and more."
1196,"Dodge, dip, duck, click and point your way in this retro-arcade death trap! The invaders are approaching, the Mothership needs your help to defend the home systems. Climb aboard, ready your Navigator 3.1X fighter craft and select some targets for the big guy to blow back to hell."
1197,"ArcheAge 5.0 – Relics of Hiram is now live! The time has come to explore long lost mysteries and unlock the new, dark power of Malediction."
1198,"Grab your friends, hone your blades, and set off for adventure in Trove, the ultimate action MMO!"
1199,The game that defined the survival-horror genre is back! Check out the remastered HD version of Resident Evil.
1200,"Now’s the chance to build the Zoo of your dreams! Just like in a real Zoo, your animals must receive complete care. Feed them, train them, cure them and even relocate them. Observe their realistic interactions with one another, the landscape, the play equipment and even Zoo visitors."
1201,"Aeon Command is a tug of war strategy game, where you play as one of three unique factions to help gain dominance over the Aeon Nebula! Take control of your mother ship to gather resources, produce ships and fight off the enemy mother ship. Grow stronger as you progress through the 24 mission campaign and unlock new upgrades."
1202,"It’s the year 1850, and there are great times ahead! Establish a transport company and be its manager. Build infrastructure such as railways and stations, purchase transportation vehicles and manage lines. Fulfill the people’s needs and watch cities evolve dynamically."
1203,"You're a survivor in the zombie infested ruins of society, and must work with your friends and forge alliances to remain among the living."
1204,Ever wanted to punch a bear IN THE MOUTH? FIST OF AWESOME asks the eternal question &quot;what would happen if bears took over the world?&quot; and answers it with the epic tale of a lumberjack travelling through time punching bears in the face to save humanity.
1205,"Battle friends over air, land and sea in this epic WW2-themed battle strategy game."
1206,"The Long Dark is a thoughtful, exploration-survival experience that challenges solo players to think for themselves as they explore an expansive frozen wilderness in the aftermath of a geomagnetic disaster. There are no zombies -- only you, the cold, and all the threats Mother Nature can muster. Welcome to the Quiet Apocalypse."
1207,"Explore a dangerous planet that's different every time and try to survive! The Galactic Union's job for you is clear: research the alien wildlife -- for science! However, in this case, researching may include lasers, explosions, hungry aliens, space sushi, and other similarly delicious-or-terrifying hazards."
1208,Play as the zombies! Infect and Destroy is an indie game in which you play as an infectious disease with the sole purpose of eliminating everyone on Earth. Play as an ultra-intelligent self-aware virus capable of reanimating the dead and turning them into your minions.
1209,"Echo of the Wilds is a puzzly narrativy adventure, featuring randomised wilderness survival. Explore and survive this mysterious tale of wilds. Gather resources to build gear and sustain yourself, learning new skills, lore and the intertwining interactions between the various areas, seasons, and weather."
1210,"Take command in Shallow Space as you gather resources, modules and blueprints to build your fleet ship by ship and lead your forces to domination in the ultimate 4X/RTS adventure in a fully 3D environment."
1211,"Another Perspective is a puzzle platformer following the very confusing adventure of someone looking for something. Swap minds to see the world in different ways! Where one mind sees a bottomless pit, another might not. Where one sees a locked door, another sees a key. To change perspective is to change reality!"
1212,Project Aura is a micro management game where you lead a Colony of Climate Disaster Survivors. You have been assigned the mission to build an habitat capable of survival in this new unknown world.
1213,"Use gravity, tension, and wind currents to get your hot air balloon to its destination, dropping off cargo on your way, in this ultra-challenging physics-based game. All art used in the Howler was meticulously created by classically-trained experienced painters."
1214,"Help Ashley Ford find her father and solve the mystery of the Three Oak Mansion. A professional thief, Ashley has inherited this hobby from her father, who suddenly disappeared one night while he was trying to sneak into the Three Oak Mansion. You start the game in front of a big, deserted house that hides a lot of secrets."
1215,Be a pioneer and build the most famous transcontinental railroad tracks in the United States of America throughout the 19th century.
1216,"Runers is a top-down rogue-like dungeon shooter where you explore a vast underground labyrinth and face fierce monsters and bosses. As the game advances further into the dungeon, you will gather Runes, which will be used to combine into 285 unique spells."
1217,"You take the part of the military and political leadership, trying to lead your nation to victory, in the midst of some of the toughest operations of the Civil War. You will build, organize and command your armies over one of the largest maps of the USA ever made for a Civil War game."
1218,"BattleSpace is a sci-fi flash game designed to play in the comfort of your web browser. In this free online strategy game, you step into the role of an Admiral, building a solar system in the depths of a faraway galaxy."
1219,"You play as a young mercenary and travel from soul to soul to avenge your fiance and her family. While finding a way to change the flow of past events, you will encounter many obstacles and meet new allies. Will you be brave enough?"
1220,"Fancy Skulls is a challenging first person shooter with procedural generation, permadeath and distinct art style. Intense and tactical combat, unique weapon mods and items that change the way you play."
1221,"Asteria is a fast paced indie platformer, wrapped up in a sandbox sci-fi world where everything is destructible, mineable, collectable, craftable and creatable."
1222,"Weave through missiles to generated music, and let the world flow around you."
1223,"Quite a different zombie game - this time YOU are the zombie! Command your infested comrades, fight your way to freedom and let the zombie kind dominate the world! Oh, and you're able to create your own scenarios!"
1224,"Velvet Sundown is a social multiplayer role-playing game, taking place on a luxury yacht cruising the waters of a fictitious Caribbean state of Balbonia. Embark on a journey full of conspiracies, trickery and secrets where you can never tell a friend from foe."
1225,The vast continent-spanning city of Collosatropolis has finally reached the limits of its expansion. Tall buildings cover every available space. The air is thick with smoke and poisonous chemicals.
1226,"You are NUX, sole survivor of the Nexon warrior tribe. The evil Silthax has invaded your home world of Nexolus, devoured your fellow Nexons and stolen the sacred power crystals from your village."
1227,"A story of greed, corruption, and real estate in 1920s Miami."
1228,"Experience the Next Generation of the #1 Fighting Franchise. Mortal Kombat X combines unparalleled, cinematic presentation with all new gameplay."
1229,"Your fight for survival begins on the frozen shores of a mysterious island, where bitter cold and vicious creatures conspire to defeat the unprepared. Uncover the land’s dark history as you and fellow castaways explore and conquer the hostile wilderness of Savage Lands."
1230,"&quot;Marine Wolrld&quot; offers 23 sea dwellers in 8 new Missions and 10 maps. A lot of new animaldevices, service, plants and..."
1231,Exciting and thrilling dinosaur-extension for the Wildlife Park univers with 11 different dinosaurs in 9 new missions.
1232,"Cricket Captain is back for the 2014 season, with a beautiful new interface, updated 3D graphics engine, and all the attention to detail that you expect. Cricket Captain has been hailed as the best cricket management simulation every created, and with one of the most exciting cricket seasons for a decade in prospect, it’s about time you..."
1233,"Gold Rush! takes you back to the year 1849, when gold was discovered in California. It was certainly one of the most exciting times in American history. Gold Rush! includes the three routes tens of thousands took to the gold regions. Become Jerrod Wilson and experience each trek as you travel from New York to California."
1234,"Guide Bob the sleepwalker to the safety of his bed by taking control of his subconscious guardian, Subob. Explore a surreal and hand-painted dream world, avoid dangers and get Bob safely back to bed."
1235,Space Program Manager (SPM) Road to the Moon is the ultimate game of space exploration. It is the mid 1950s and the race for dominance between the US and the Soviet Union is about to move into a new dimension: space.
1236,"Dungeon-Crawling First Person Shooting at its finest! Fast-paced combat! Dozens of perks, spells and enemies! Level ups! Random Dungeons! Traps! Badass bosses! Carrots!"
1237,"Start an adventure in a world full of monster hunters! A huge monster RPG that can be played either in single player or MMORPG mode. Includes PvP, trading, split screen, gamepad support and cross-platform online support!"
1238,"Orborun is a 3D action skill run &amp; roll game! Control your Orbot, avoid the obstacles and escape the hazardous Orbo-world. More than 100 levels, local co-op multiplayer, feeling of speed and twisted levels in haste/puzzle and hazard shaped different worlds makes this game fun to play for ages!"
1239,"The Nightmare Cooperative is a fiendishly difficult turnbased roguelike featuring an array of characters, each with different powers to help you destroy monsters, escape levels, and collect gold."
1240,"Congratulations! You’ve been accepted as the only human student at the prestigious St. PigeoNation’s Institute, a school for talented birds! Roam the halls and find love in between classes as a sophomore student at the world’s greatest pigeon high school."
1241,"The Way of Life makes the player relive the same life's experiences from the point of view of three characters of different ages: an adult, an old man and a child."
1242,"Deathtrap is a Tower Defense game with strong action-RPG elements, a game of vicious tricks, killing machines, rotating blades and splattering blood."
1243,"DiRT Rally is the most authentic and thrilling rally game ever made, road-tested over 80 million miles by the DiRT community. It perfectly captures that white knuckle feeling of racing on the edge as you hurtle along dangerous roads, knowing that one crash could irreparably harm your stage time."
1244,"Will you become the greatest Head of State ?Play one of the powerful rulers of a nation! . Slip into the shoes of the President of the U.S., or the leader of China, Russia, United Kingdom, or other countries. Expand your influence on the world stage."
1245,"It's the year 2351, and you're a pilot trying to rise through the ranks all the way to glory. As a member of the Galactic Federation, you'll be granted more than 20 weapons to use in each pass-fail mission. Your goal is to defend the planet from attacking alien forces, and you'll put your skills into play across more than 30 campaigns."
1246,&quot;The Stalin Subway&quot; is a First Person Shooter-style game where the events take place in post-war Moscow. The game allows to plunge into the depressing atmosphere of the Stalin's period and to play as a Soviet officer.
1247,"In Super Panda Adventures, you play as the brave panda-knight Fu, who is about to finish his training to become the new guardian of the Princess. At the same day of the big celebration party, some uninvited Robots show up to conquer the planet and take the Princess away in their Space Ships!"
1248,"Vertical Drop Heroes is a procedural platformer RPG hybrid with roguelike elements, where your hero adventures through randomly generated stages. Armed with a variety of skills and traits, you must use your cunning and reflexes to survive the dangers of each stage."
1249,"Jack into cyberspace at lightspeed in this FPS looter/shooter. Play solo or jump into online co-op/pvp with up to 10 people. Hack megacorps, outmaneuver their AI defenses, and steal their procedural loot to customize your arsenal of synergistic weaponry. Think Borderlands meets Tron. Hack the planet!"
1250,"Wild Warfare is a F2P, multiplayer FPS made for players that enjoy fun and/or being a bear. It's a mix of crazy game modes, balanced classes, simple controls and intense matches. Its got vehicle combat, because why not? You can even be a bunny that clubs people with a wrench, lucky you."
1251,"The Fifth Day is a post-apocalyptic survival game set in the time after mankind's extinction to the machines that it created. Your role, as one of these machines, is to survive in the hostile world left behind by man."
1252,"The classic board game comes to Steam with asynchronous online play and 100 levels of AI. If you are a chess enthusiast or someone who just likes to play a game now and again, this is what you've been looking for. This is Simply Chess."
1253,Ageod’s To End All Wars is a grand strategy game set during World War One. Players will take control over one of the major powers that so desperately fought for control over Europe and to end all wars.
1254,"Enter the futuristic year of 1984, an age where ducks run wild in a frantic battle for glory. Blast your friends with Shotguns, Net Guns, Mind Control Rays, Saxophones, Magnet Guns, and much, much more. This is DUCK GAME. Don't blink."
1255,"“METAL SLUG X”, one of the most highly praised titles in the series among Metal Slug fans for its refined balance and game volume, heads out to the Steam gaming platform!"
1256,"Take command of HEROCORP™ and launch a Preemptive Defence Campaign™ against parallel dimensions in OTTTD, the most outrageous Tower Defence title around."
1257,"With a monster soundtrack, challenging gameplay and an impressive arsenal of weapons - Power-Up is the modern-retro styled Shoot-Em-Up from one-man game studio, Psychotic Psoftware."
1258,"Officially licensed version of the “Mensa Select” award-winning board game! The Laser Game Khet 2.0: Mind blowing laser fun for players ages 9-99. Using simple rules that can be learned in minutes players alternate turns moving Egyptian themed mirrored pieces, after which they fire their laser with the goal of blasting their opponents..."
1259,"FINAL FANTASY IV makes its debut on PC! Lose yourself in this timeless tale of heroes, betrayal, love and redemption."
1260,"Way of the Samurai 4 takes place in the humble port town of Amihama during the mid 19th Century, several years after the arrival of the “black ships” from the West ended Japan’s long history of cultural isolation."
1261,"The Expendabros have assembled and set their sights on the forces of ruthless arms dealer Conrad Stonebanks in the forests of Eastern Europe. Battle in a flurry of bullets and non-stop action through ten full-throttle missions set amongst the picturesque tree tops and the absurdly dangerous lumber mills teeming with enemy soldiers,..."
1262,"Design, build, and manage the world’s largest and most diverse cities in Cities XXL. Bigger and better than ever before with a more powerful game engine and new interface, become the mayor of your very own sprawling metropolis."
1263,"Soul Gambler puts YOU in the role of Faust, an ordinary young man living in the present day whose DESTINY is about to be change forever."
1264,"Tactical squad-based heist game set in 1970s. The 2D top-down view gives you a great overview of what's happening at any given moment, allowing you to be a real criminal mastermind. Can you pull off the greatest heist in the history of mankind?"
1265,Take the role of a plane crash survivor stranded somewhere in the Pacific Ocean. Come face to face with some of the most life threatening scenarios that will result in a different experience each time you play. Scavenge. Discover. Survive.
1266,"A relentless top-down single-player arcade stealth-shooter where you play as contract killer T.J. Trench, seeking to buy your way out of Metro City, the cyberpunk dystopia where everyone wants you dead."
1267,"Welcome to the new generation of Farming Simulator!With a brand new graphics and physics engine, Farming Simulator 15 offers an immense open world, filled with details and visual effects transporting the Farming Simulator franchise to a new era."
1268,Existential Nature Simulation
1269,"March into the real-time strategy legend, Blitzkrieg, and prepare for war. This legendary WWII RTS blends unprecedented realism and accuracy to form immersive 3D backgrounds and a game where brute force often takes a back seat to strategy and wits."
1270,"Return to the bloody battlefields of World War II in this epic sequel. Blitzkrieg 2 returns you to the gritty realism of WWII battles while pushing your focus into new, strategic opportunities during global war!"
1271,"Join Bunny and his pals Gunny, Faye, and Ganny on an epic quest to earn enough money to buy himself an Auto-repair unit!Boo Bunny Plague is an action/adventure game featuring a story with wacky musical cinematic scenes. The all original soundtrack has everything from punk rock to opera and feature musicians from Houston Texas."
1272,"Rising Judo Star Gushiken Takahiro was two weeks away from the match that would make or break his career -- a championship match where the winner is then signed up to be a young national athlete for Japan. He was very determined to win, in order to fulfill his dreams of finally representing his country for a sport he loves so much."
1273,Boid is real-time strategy at its most primal - your only resource is your army. No funds to manage or infrastructures to build. It’s a kill or be killed battle of rapid decisions to dominate the gene pool.
1274,"Morphopolis is about transformation and discovery. Morphopolis takes you on a puzzle adventure through a fantastical insect world. Starting as an aphid grub, you embark on an epic journey of metamorphosis toward your spawning ground."
1275,"As humanity endeavored to better themselves, they created the biological marvel known as Gears. Originally intended as the next step of human evolution, they were instead fitted for war and turned against their own creators."
1276,A single-developer passion project. Seamless full scale solar system / balls-up action. Be part of the journey as a Universe is built from the ground up!
1277,"Hire heroes, send them on quests, get loot and make a profit as you expand from nothing into a bustling fantasy kingdom and attempt to win the coveted title of the greatest kingdom in all of the land!"
1278,"Jet Gunner is a 2D platform action indie game that's full of Nestalgia. Full of action, gunfights, bosses and explosions so if you're into the whole 8-Bit vibe you should love this. From the sound, to the graphics to the flicker, this should pay tribute to those classic hard as nails, run 'n' gun games."
1279,"Losing his parents during the holocaust to a mad man of a doctor. You're to play as Grobuskna Vladinov, 20 years after the incident that changed his life dramatically. Grobuskna receives an unknown phone call that'll start a journey that'll twist your mind..."
1280,Fight your way through 50 levels full of thrilling action with hordes of challenging enemies and tough bosses! Obludia is an old-school arcade arena action inspired by classics such as Robotron or Smash-TV with RPG elements.
1281,"In GamersGoMakers, you found a little company creating the first video games in history. Create your first game with only basic sound and simple graphics available in the year 1980. You´re one of the pioneers entering the rising global market for computer games."
1282,"Rampage Knights is a cooperative beat 'em up game mixed up with randomized dungeon crawling and exploration, which you can play alone or with a friend online."
1283,"A Broken Land, shattered by the Wizards of old, the Fragments of the Old World are adrift in the Void. You must visit and restore each Fragment of the Void, only then can the World be rebuilt. However you are trapped in a crystal body, unable to act alone. Heroes of a Broken Land is a turn-based, dungeon crawling, town management RPG."
1284,"In the dark times of the Medieval a baleful society of the Cult and its adherers strived to seize the rule over the city, control its inhabitants and destroy all sources of knowledge and culture. Help Marla uncover the secret conspiracy, release her kidnapped brother and save the city!"
1285,"Euro Fishing immerses you deep into the adrenaline-packed action, fun and beauty of Europe’s most famous lakes. Master your rod, line and tactics, and refine your technique to become a top angler. This is the closest you can get to real fishing from the comfort of your own couch."
1286,"In a world where Viking mythology collides with magic, explore the world of KYN in a fast paced role playing strategy game that combines party based combat with exploration and progression."
1287,"Explore, blast, and shield your way through massive branching levels as Laika the space dog. This 2D adventure features customized gameplay and an incredibly deep narrative."
1288,"A kleptomaniac, a sociopath and a horrible friend. Randal is potentially one of the most scurrile protagonists since the invention of the hoverboard. Randal's Monday is a crazy space-time odyssey in classic adventure design, spiced up with countless geek culture references of the last 30 years."
1289,"Blackguards 2 is a turn-based strategy-RPG and will deliver challenging hexfield battles and a gritty story filled with violence and crime. - Includes bonus content: Soundtrack, digital Art Book and Strategy Guide Book!"
1290,Blob From Space is a 2d side scroller game. Difficulty will change when progressing. Try to survive many challenges with only 3 continues! Let the rage begin!
1291,"A 2.5D action-packed side-scrolling game, takes players on a thrilling sci-fi adventure! Take control of combat specialist Ares, or the new playable character, Tarus, to battle deadly machines with a variety of powerful weapons and armor. Your goal: Save Minos Space Station’s survivors and uncover the nefarious Zytron’s extinction agenda!"
1292,"Polarity takes it to the next level, demanding all of your wits and reflexes. Full-featured local co-op campaign."
