appid,short_description
0,Play the world's number 1 online action game. Engage in an incredibly realistic brand of terrorist warfare in this wildly popular team-based game. Ally with teammates to complete strategic missions. Take out enemy sites. Rescue hostages. Your role affects your team's success. Your team's success affects your role.
1,"One of the most popular online action games of all time, Team Fortress Classic features over nine character classes -- from Medic to Spy to Demolition Man -- enlisted in a unique style of online team warfare. Each character class possesses unique weapons, items, and abilities, as teams compete online in a variety of game play modes."
2,"Enlist in an intense brand of Axis vs. Allied teamplay set in the WWII European Theatre of Operations. Players assume the role of light/assault/heavy infantry, sniper or machine-gunner class, each with a unique arsenal of historical weaponry at their disposal. Missions are based on key historical operations."
3,"Enjoy fast-paced multiplayer gaming with Deathmatch Classic (a.k.a. DMC). Valve's tribute to the work of id software, DMC invites players to grab their rocket launchers and put their reflexes to the test in a collection of futuristic settings."
4,"A futuristic action game that challenges your agility as well as your aim, Ricochet features one-on-one and team matches played in a variety of futuristic battle arenas."
5,"Named Game of the Year by over 50 publications, Valve's debut title blends action and adventure with award-winning technology to create a frighteningly realistic world where players must think to survive. Also includes an exciting multiplayer mode that allows you to play against friends and enemies around the world."
6,"1998. HALF-LIFE sends a shock through the game industry with its combination of pounding action and continuous, immersive storytelling. Valve's debut title wins more than 50 game-of-the-year awards on its way to being named ""Best PC Game Ever"" by PC Gamer, and launches a franchise with more than eight million retail units sold worldwide."
7,"Portal&trade; is a new single player game from Valve. Set in the mysterious Aperture Science Laboratories, Portal has been called one of the most innovative new games on the horizon and will offer gamers hours of unique gameplay."
8,"Nine distinct classes provide a broad range of tactical abilities and personalities. Constantly updated with new game modes, maps, equipment and, most importantly, hats!"
9,"From Valve (the creators of Counter-Strike, Half-Life and more) comes Left 4 Dead, a co-op action horror game for the PC and Xbox 360 that casts up to four players in an epic struggle for survival against swarming zombie hordes and terrifying mutant monsters."
10,"Set in the zombie apocalypse, Left 4 Dead 2 (L4D2) is the highly anticipated sequel to the award-winning Left 4 Dead, the #1 co-op game of 2008. This co-operative action horror FPS takes you and your friends through the cities, swamps and cemeteries of the Deep South, from Savannah to New Orleans across five expansive campaigns."
11,"Every day, millions of players worldwide enter battle as one of over a hundred Dota heroes. And no matter if it's their 10th hour of play or 1,000th, there's always something new to discover. With regular updates that ensure a constant evolution of gameplay, features, and heroes, Dota 2 has taken on a life of its own."
12,The &quot;Perpetual Testing Initiative&quot; has been expanded to allow you to design co-op puzzles for you and your friends!
13,Co-operative multiplayer game and complete code base available for free.
14,"Featuring a wide collection of single and multiplayer games, either online or with multiple mice, Rag Doll Kung Fu provides players with one of the most creative and unique game experiences delivered in years."
15,"6-player co-op survival horror at its finest! Free updates, free special events and a ridiculous amount of fun!"
16,"Combining fast-paced action with strategic battle planning, Darwinia features a novel and intuitive control mechanism, a graphical style ripped from 80's retro classics like Tron and Defender, and a story concerning a tribe of nomadic sprites trapped in a modern 3D world."
17,"You play an Uplink Agent who makes a living by performing jobs for major corporations. Your tasks involve hacking into rival computer systems, stealing research data, sabotaging other companies, laundering money, erasing evidence, or framing innocent people."
18,"Inspired by the 1983 cult classic film, Wargames, DEFCON superbly evokes the tension, paranoia and suspicion of the Cold War era, playing on the fascinating aspects of psychological gameplay that occur during strategic nuclear warfare. You play a General hidden deep within an underground bunker."
19,"&quot;Long ago a computer scientist called Dr Sepulveda created a beautiful digital world existing entirely within a computer network of his own invention. This world was called Darwinia and it was inhabited by a peaceful, law-abiding digital life-form called the Darwinians."
20,"S.C.S. - Dangerous Waters allows you total control over multiple air, surface, and submarine platforms in a modern-day naval environment. Take direct control of individual crew stations and also plan and execute combined arms naval strategies from a top-down 'Commanders Eye' perspective."
21,"The award-winning Space Empires IV Deluxe is the latest edition in the Space Empires series. A grand strategy title in the space 4X (explore, expand, exploit, and exterminate) genre, Space Empires has already found a place in the heart of strategy gamers everywhere."
22,"Space Empires V is the latest edition in the Space Empires series. This new chapter completely updates the UI and takes the player into a real-time rendered 3D universe. Watch space battles played out in glorious detail and realistic effects. Expand, Explore, Exploit, and Exterminate in a huge living breathing galaxy."
23,This critically acclaimed first-person RPG takes the player on an amazing journey into the fantasy world of Arx. The game mixes intelligent story with immersive and actual medieval surroundings. Arx Fatalis allows the player to feel that all his actions have a direct consequence on those around him.
24,"The Source Filmmaker (SFM) is the movie-making tool built and used by us here at Valve to make movies inside the Source game engine. Because the SFM uses the same assets as the game, anything that exists in the game can be used in the movie, and vice versa."
25,"After the destruction of the EARTH in 2150, the leaders of the Eurasian Dynasty escaped on board an evacuation fleet. Now they are fighting for the survival of the human species. Their base is one large building comprising of smaller variable parts."
26,"... 300 years after Aziraal has been banished, a brother and sister are drawn into the conflict which has flared up between the Orcs and the free world. Kyra, the hero's younger sister, suddenly disappears in mysterious circumstances.«...If my family really belongs to the chosen ones, why then have we always been as poor as church mice?"
27,"Welcome to the Arena, where high-ranking warriors are transformed into spineless mush. Abandoning every ounce of common sense and any trace of doubt, you lunge onto a stage of harrowing landscapes and veiled abysses."
28,"Maybe it was the fact that people got to blow away Nazis. Maybe it was the sheer challenge of it all. For whatever reason, Wolfenstein 3D and Spear of Destiny, pioneered the first-person shooter genre and brought its legendary creators, id Software, worldwide notoriety and numerous awards."
29,"Two New, 32-Level DOOM II Episodes. Evilution: Far from earth, the UAC recommenced their experiments on on of the moons of Jupiter. A spaceship, mistaken for a supply vexxel on radar, hovered above the base. Hideous demons poured out, blanketing the base with death. All your comrades were quickly slaughtered or zombified."
30,"Congratulations, you’ve just been cast in your first slasher movie by the notorious Director X!"
31,"Shadowgrounds breathes fresh air into the action genre with explosive combat sequences, an innovative weapon upgrade system, and an intriguing storyline. The adrenaline-pumping, top-down gameplay and audiovisual fireworks set the scene for this new action experience which also includes single computer (split keyboard or joystick) co-op..."
32,"Somewhere in deep space, at an apparently abandoned mining base on the asteriod Alpha Prime, something has gone terribly wrong. Miners were warned that the hubbardium they were mining was too dangerous, but the lure of unimaginable wealth was too strong."
33,"In the distant future, the X universe faces a period of profound and irrevocable change. While the universe stumbles towards an uncertain future, countless adventures await as new enemies rise in search of power."
34,"Xpand Rally Xtreme shows the true climate and conditions of rally racing. Dangerous, technical tracks, based on the world's hardest special stages full of moguls,jumps,grooves and tight hairpins. By winning races amass funds for faster cars and repairs."
35,"Three thousand years in the future, mankind has carved a bloody path towards domination of the known universe. Self-proclaimed as a divine race and beyond reproach as a species, they view all alien races as inferior."
36,"The critically-acclaimed and award-winning FPS franchise is back! Packed with tons of fast-paced, adrenaline-fueled single player and multiplayer action, Painkiller Overdose brings with it 6 innovative new demonic weapons, mind-bending physics, lightning-player maps, over 40 demented and sickly-twisted monsters from Hell and gigantic end..."
37,"Survive the ancient temples of Zuma, the critically acclaimed action-puzzler from PopCap! Deep in the jungle lie hidden temples bursting with traps and trickery, and it's up to you to uncover their treasures."
38,"Take your best shot with energizing arcade fun! Aim, shoot, clear the orange pegs, then sit back and cheer as 10 whimsical teachers guide you to Peggle greatness. Conquer 55 fanciful levels with 10 mystical Magic Powers, racking up bonus points and shots you'll smile about for weeks."
39,"Mayday! The Peggle Institute has been invaded by a host of other-worldly creatures. It's up to you, Peggle Master, to report to duty and shoot and bounce the critters to oblivion. Take your best shot with energizing arcade fun, now exclusively themed with art and sounds from The Orange Box!"
40,"Pieces of an ancient stone tablet have started turning up around the globe and the Museum needs your help to locate the pieces and find the most expensive gem ever known...the &#147;World Diamond&#148;. Under the direction of the Museum, you must immediately begin your global seek & find adventure."
41,An unexpected storm has left you shipwrecked on a mysterious and remote private island. Seek & find cleverly hidden objects and solve puzzles to find a way off the island! Find over 2100 hidden objects in 25 intriguing and mysterious locations to find items that will help you escape!
42,"As World War II draws to a close, the first covert battles of the Cold War begin. Caught in the life and death struggle between Soviets and Germans in war-torn Berlin, you control the fate of a lone American OSS Sniper."
43,"Everybody wants to rule the world! Achieve global power with EVIL GENIUS, the one and only complete world domination simulator. All the everyday tasks of the deliciously wicked mastermind are available to experience and master from building your ultra-secret base to developing spectacular super-weapons to carry out your nefarious master..."
44,"Aliens Versus Predator Classic 2000 features the Colonial Marine, Alien and Predator Campaigns and the frenetic single-player Skirmish mode from the original title: Alien Versus Predator Gold Edition, which was released to massive acclaim in 2000."
45,"In the years between the World Wars, Agent BloodRayne works as a killing machine for The Brimstone Society--a top secret fraternity that hunts down and destroys supernatural threats. Starring heroine Rayne, this original action horror game unleashed the red headed dhampir on the world."
46,"BloodRayne is a dhampir, born from the unnatural union of vampire and human. Blessed with the powers of a vampire but cursed with the thirst for blood and a weakness to sunlight, Rayne is challenged with her most personal battle yet as she hunts down her siblings."
47,"A Psychic Odyssey Through the Minds of Misfits, Monsters, and Madmen. This classic action/adventure platformer from acclaimed developers Double Fine Productions follows the story of a young psychic named Razputin."
48,"Sail the Caribbean, marauding all on the high seas or ally your ship and crew as a privateer in search of riches - the life you choose is up to you. Face dogged enemies, raid unsuspecting villages, woo fair maidens, avoid capture or dig for buried treasure. Discover what it takes to become one of the most famous pirates in history!"
49,"Following a great increase in terrorism, internal strife and ultimately, the nuclear destruction of Washington, D.C., the United States shatters into a half-dozen nation-states that descend into war. Take the helm of one of these newfound sovereignties (or the 'peacekeeping' European Expeditionary Force) and struggle to reunify America..."
50,Garry's Mod is a physics sandbox. There aren't any predefined aims or goals. We give you the tools and leave you to play.
51,"RoboBlitz&trade; is a humorous, physics-based action game full of inventive gizmos, weapons, characters, and environments. Players take on the role of Blitz, a multi-talented robot who must activate an aging Space Cannon to save his world from a band of maladjusted space pirates."
52,"Silverfall, a once glorious city, lies in the fantastical Kingdom of Nelwë, where the forces of Technology and Nature are strongly opposed. Symptoms of this terrible conflict have begun to manifest physically as melded cyberbiologic organics and living steam-driven automatons."
53,"Construct the city of the 21st Century with City Life! City Life 2008 Edition is a next-generation City Builder. Its 3D game engine provides a level of detail and animation unprecedented in the City Builder genre, with total freedom of construction."
54,"The U.S. Army is the most powerful ground force in the entire world. The backbone of a ground invasion is the U.S. Army Infantry, and in the midst of combat, their skills, courage, and teamwork are put to the test. While readiness continues to be the U.S. Army's top priority, how it goes about its business is changing."
55,A fast paced multiplayer shooter that pits aliens against humans in a strategic and action-packed struggle for survival!
56,"Shank is the cult-classic revival of the sidescrolling beat-em-up. Play as Shank in an over-the-top grindhouse game, packed to the rim with enemies, bosses, combos, and more by the award-winning team at Klei Entertainment."
57,"FlatOut is adrenaline-filled muscle car racing game packed with explosive physics, spectacular effects and graphics, innovative game play mechanics and good old fun! Eight players or AI cars on track for close pack racing Single player Career, Quick race and Time trial modes Multiplayer mayhem with up to 8 players 16 different fully..."
58,"The Longest Journey is an amazing graphical adventure, where the player controls the protagonist, April Ryan, on her journey between parallel universes."
59,"Bloodline Champions is a Free-to-Play online PvP Arena game where players engage in short, intense battles of up to ten players divided into two teams. Each player takes control over one of several bloodlines, each with their own unique weapons and abilities. Easy to learn, challenging to master."
60,"Your world...Your rules! In Just Cause, you are a Latin field operative and specialist in regime change backed by top secret US government agency who will overthrow the corrupt government of San Esperito."
61,"Nu Earth: a poisoned planet where endless war rages between the Norts and the Southers. A futile struggle on a hostile planet with no end in sight. But there are tales of a lone warrior. A man who knows no allegiance, the Rogue Trooper!"
62,"In X-Blades, the player takes on the role of the enchanting heroine Ayumi, who survives a breathtaking dance of blades through the Hordes of Darkness. The long-haired beautiful anime, with her pistol blades and mind-blowing leaps, whirls and swirls from one fantastic level to the next."
63,"While the bloody battle between Gandohar’s troops and the armies of the Orcs is raging in front of the gates of Oswaroth, the emperor waits in the depths of his palace on the outcome of the struggle for power."
64,"Sid Meier's Railroads! marks the return of the watershed title in simulation/strategy gaming that launched the popular &quot;tycoon&quot; genre, and inspired a new generation of games. Sid Meier's Railroads!"
65,"Railroad Tycoon 3 features 25 scenarios challenging players to recreate magnificent feats of railroading history from around the world. Players can lay track (including tunnels and overpasses), pick from over 40 locomotives from early steams to modern bullets, choose to haul over 35 types of cargo in a dynamic economy, and participate in..."
66,"Experience one war through two epic sagas where you will be a part of history or change it. Feel the power of the historically authentic and decisive battles of the Pacific War. Relive some of the grandest and most critical naval battles of recent history and for the first time, choose to lead your fleet to a completely different ending..."
67,Dive into an adrenaline-fuelled free-roaming adventure with 400 square miles of rugged terrain and hundreds of weapons and vehicles.
68,"EVE Online is a community-driven spaceship MMO where players can play free, choosing their own path from countless options. Experience space exploration, immense PvP and PvE battles, mining, industry and a thriving player economy in an ever-expanding sandbox."
69,"UpdateSimBin Studios expands the hit racing game, RACE 07 with the Andy Priaulx Crowne Plaza Raceway free add-on. Free for owners of RACE 07, this add-on features a brand new island track and new cars from triple World Champion Andy Priaulx in his BMW 320si WTCC and Fabrizio Giovanardi in his Vauxhall Vectra VXR.Real Cars, Real Racing..."
70,"Indebted to the wrong people, with his life on the line, veteran of the U.S. Cavalry and now hired gun, Booker DeWitt has only one opportunity to wipe his slate clean. He must rescue Elizabeth, a mysterious girl imprisoned since childhood and locked up in the flying city of Columbia."
71,"From a distant corner of the galaxy, an evil alien race sets in motion a sinister plan to conquer the Earth. They unleash a powerful catalyst — Energy X — that imbues the planet's worst miscreants with super-powers to bring the planet to its knees. Now Earth's only hope lies with a new breed of heroes... The Freedom Force!"
72,"World War II rages and nations fall. SS head Himmler has Hitler's full backing to twist science and the occult into an army capable of annihilating the Allies once and for all. Battling alone, you're on an intense mission to pierce the black heart of the Third Reich and stop Himmler -- or die trying."
73,"A massive demonic invasion has overwhelmed the Union Aerospace Corporation's (UAC) Mars Research Facility, leaving only chaos and horror in its wake. As one of only a few survivors, you must fight your way to hell and back against a horde of evil monsters."
74,"The Four Horsemen of the Apocalypse lurk in the shadows before you. They are Death, Pestilence, Famine, and War. They are the root of all that is evil. They are the least of your worries. The last know Serpent Rider, Eidolon, lives."
75,"Powered by id’s revolutionary id Tech® 5 technology, RAGE is an intense first-person shooter with breakneck vehicle combat, an expansive world to explore, and jaw-dropping graphics!"
76,"For a thousand years, three opposing forces have waged war for what they believe is true. There can be no room for compromise: their way is the only way. Dubbed The Infinite War, this devastating conflict has taken its toll on a once-peaceful galaxy and has only served to deepen the hatred between the factions."
77,"Saints Row 2 brings true freedom to open-world gaming. Players can play as who they want, how they want, and with whomever they want in this sequel to the much acclaimed and tremendously successful Saints Row."
78,"Gish isn't your average hero. In fact, he's not your average anything...you see, Gish is a ball of tar. A Sunday stroll with his lady friend, Brea, goes awry when a shadowy figure emerges from an open manhole and pulls Brea below ground."
79,"Grab your cape and defend Millennium City in this comic book-style action MMORPG! Design your hero and costume from thousands of costume pieces, face super-villains like Dr. Destroyer, and create your own unique nemesis."
80,"In Star Trek Online, the Star Trek universe appears for the first time on a truly massive scale. Players take the captain's chair as they command their own starship and crew. Explore strange new worlds, seek out new life and new civilizations, and boldly go where no one has gone before."
81,"The UnderGarden is a casual Zen game that challenges players to explore beautiful underground caverns filled with strange life forms, sound, music and plenty of hidden secrets. Casual gamers with an affinity towards puzzle games will enjoy The UnderGarden’s modern exploration quest filled with brain teasing games that combine state of..."
82,"The remote hotel stands atop an ominous snow-peaked mountain, and death permeates every inch of the place. A crime has been committed here obviously, and the remote nature of the retreat means that the culprit is still roaming the halls. Which of the guests is capable of this? Whose past hides sinister truths and who has the most to gain?"
83,"Dracula: Origin reveals the dark origins of the Dracula curse. Once the ardent defender of Christendom, Dracula loses his faith in God when he is abandoned by his one true love after she marries. Dracula then makes a pact with the Prince of Darkness, and becomes a vampire."
84,"Recognized as one of the best licenses in adventure gaming and lauded by the international press, Sherlock Holmes is back with an investigation that is sure to be the most horrifying of the series. In this great new adventure, the famous detective chases against the most threatening serial killer England has ever known - Jack the Ripper."
85,"Surviving is only half the game. The award-winning atmosphere and gameplay mechanics of the original Shadowgrounds make a triumphant return in this spin off/sequel armed with a slick new feature set! Shadowgrounds Survivor tells the story of the last remaining humans on Jupiter's moon Ganymede, where the alien onslaught is in full force."
86,"On December 7, 1941, a major part of the U.S. Pacific navy stationed at Pearl Harbor was assaulted by Japanese planes. Japanese fighters were destroying American aircraft on land and in the air, without giving them a chance for a counterattack. The furious battle of Pearl Harbor became the first in the sequence of gory sea combats."
87,"Pacific Storm: Allies expands upon the success of the internationally acclaimed original to deliver an unforgettable mix of real-time strategy and blistering arcade combat, recreating World War II's most heated battles."
88,"Obulis can literally be learned in seconds, but the puzzles will keep you thinking for hours."
89,"Larva Mortus is a fast-paced action horror game that has you hunting monsters of the supernatural in a dark and ominous atmosphere full of undead, terrifying and demonic nightmares."
90,"Chains is a challenging puzzle game with a unique feel and distinctive vector graphics style. The object of the game is simple - to link adjacent bubbles of the same color into chains. As you progress through the physics-driven stages it becomes increasingly more challenging and players' speed, strategy and skill will be put to the test."
91,"Develop your own hospital drama and manipulate the results to your best advantage! In charge of a rapidly expanding hospital, your job is to cure the patients with your army of doctors and nurses while successfully managing the facilities and taking care of everyone's needs."
92,"Welcome to Liberty City. Where it all began. With stellar voice acting, a darkly comic storyline, a stunning soundtrack and revolutionary open-world gameplay, Grand Theft Auto III is the game that defined the open world genre for a generation."
93,"Max Payne is a man with nothing to lose in the violent, cold urban night. A fugitive undercover cop framed for murder, hunted by cops and the mob, Max is a man with his back against the wall, fighting a battle he cannot hope to win."
94,Drive dozens of varied vehicles around three of America's toughest cities. Only the best will be able to tame the fastest cars. Only the smartest will know all the short-cuts and the whereabouts of the hottest wheels. Only the toughest will be able to take on the world and finish the job like a professional...
95,"Grand Theft Auto is back. The cars are faster. The streets are busier. The bad guys are nastier. The police are angrier. And now, the FBI and the Army are getting involved... Seven ruthless gangs are involved in a ruthless power struggle and it is up to you to make a name for yourself. Respect is earned, not given."
96,"What does the American dream mean today? For Niko Bellic fresh off the boat from Europe, it is the hope he can escape from his past. For his cousin, Roman, it is the vision that together they can find fortune in Liberty City, gateway to the land of opportunity."
